{
  "eventId": "aaaaaaaa-aaaa-4aaa-8aaa-aaaaaaaaaaa5",
  "eventType": "document.processing.completed.v2",
  "occurredAt": "2026-08-05T15:00:02Z",
  "correlationId": "11111111-1111-4111-8111-111111111111",
  "documentId": "22222222-2222-4222-8222-222222222222",
  "jobId": "33333333-3333-4333-8333-333333333333",
  "objectKey": "documents/22222222-2222-4222-8222-222222222222/source.pdf",
  "sourceSha256": "0123456789abcdef0123456789abcdef0123456789abcdef0123456789abcdef",
  "modelVersion": "document-type-v1",
  "classification": "invoice",
  "confidence": 0.98,
  "modelEvidence": {
    "status": "measured",
    "datasetVersion": "reactorfront-synthetic-documents-v1",
    "datasetSha256": "e82005c8ca78b7966f24e1faaf2a2b161262f1e774dc813e0c2d0743280cb046",
    "preprocessingVersion": "nfkc-ascii-alphanumeric-bow-v1",
    "pipelineVersion": "pytorch-multinomial-naive-bayes-linear-v1",
    "artifactSha256": "82996b9d7a715ee8aee3b9b291cb9538346d84f5398c6b4448c1c79725e9c2ac",
    "evaluationPolicyVersion": "document-classification-evaluation-v1",
    "evaluationPolicySha256": "e3431c6d4e9094b8bd88b77a4ba4abc860641d7f83eaf71a5ee71c8f46bae332",
    "evaluationReportSha256": "1337d7bf0368799ebd2bc088cfda16544ca78c3ed77f96ba265a7d9b090a19b5"
  }
}
